{
  "phase": "spec_challenge",
  "role": "reviewer",
  "run_id": "run-2026-03-11-example",
  "created_at": "2026-03-11T12:25:00Z",
  "sources": [
    "artifacts/run-2026-03-11/spec.json"
  ],
  "status": "complete",
  "loop_number": 1,
  "findings": [
    "The spec must define archive behavior explicitly so deletions stay reproducible."
  ]
}
